Question,Segment Type,Segment Description,Answer,Count,Percentage,Single,timestamp
are there any good romantic comedies out right now,Mobile,Mobile respondents,Yes,19,0.96695176990641,False,19/03/21
show me a movie about cars that talk,Web,Mobile respondents,No,430,0.514801671117009,False,19/05/21
list the five star rated movies starring mel gibson,Mobile,Mobile respondents,I don't use Tinder,479,0.53901418715461,False,28/01/21
what science fiction films have come out recently,University,Web-based respondents,Yes,194,0.29566897103433,True,03/08/21
did the same director make all of the harry potter movies,University,Web-based respondents,No,19,0.401145420868218,True,25/06/21
show me 1980s action movies,University,Web-based respondents,I don't use Tinder,438,0.931669021058251,False,08/06/21
what is the name of the third movie in the star trek series,University,Male respondents,Yes,345,0.377296690532886,False,06/02/21
can you get a soundtrac for the harry potter films,University,Male respondents,No,124,0.85572017875901,True,04/04/21
find me science fiction movies since 2005,Mobile,Male respondents,I don't use Tinder,330,0.455284378793058,True,19/02/21
what is the most current movie featuring mat damon,Mobile,Female respondents,Yes,136,0.289715426612171,True,24/12/21
show me films where jim carrey is a detective,Mobile,Female respondents,No,236,0.635463359824536,False,18/07/21
did george clooney make a musical in the 1980s,University,Female respondents,I don't use Tinder,313,0.026556676045258,False,09/10/21
show me films with both matt damon ad ben affleck,Mobile,Chapman University,Yes,24,0.034770251746921,False,04/09/21
what is the borrowers movie,University,Chapman University,No,352,0.058781424351462,False,18/12/21
have u movie hm about to pg 18,University,Chapman University,I don't use Tinder,468,0.804120161529991,False,24/08/21
find rated g films with flying cars,University,Cornell University,Yes,15,0.687085072517745,False,03/03/21
what was the best rated stanley kubrick film,University,Cornell University,No,148,0.013489627897105,True,16/11/21
are there any films directed by shawn levy about large families,University,Cornell University,I don't use Tinder,268,0.131267303984126,False,08/11/21
list pg rated movies about cars released in the 1990s,Web,Duke University,Yes,242,0.395502115295777,True,22/10/21
what movie won best picure at the 2012 oscars,Mobile,Duke University,No,316,0.50348659512702,True,18/09/21
find me childrens movies with daniel radcliffe from the 2000s,Web,Duke University,I don't use Tinder,37,0.050187125073879,True,01/07/21
what was the plot behind 3 days of the condor,Mobile,George Washington University,Yes,189,0.731430325396749,True,04/12/21
what are considered the must see sci fi movies of the 1970s,Mobile,George Washington University,No,368,0.483636922924564,False,01/03/21
who directed the film pulp fiction that starred john travolta,University,George Washington University,I don't use Tinder,100,0.409012603939592,True,09/08/21
which film has the highest viewer rating this year,University,Georgetown University,Yes,270,0.684231478687358,True,19/04/21
what was the first movie in color,Mobile,Georgetown University,No,236,0.45489151020916,True,03/02/21
may i have the highly acclaimed film from 1985 directed by sylvester stallone,University,Georgetown University,I don't use Tinder,214,0.884580245059637,True,16/04/21
list the action films starring hugh jackman,University,Harvard University,Yes,305,0.538560974568398,False,02/12/21
what is a bronx tale rated,Mobile,Harvard University,No,193,0.294180855870157,True,21/07/21
is there a pg 13 movie thats scary,Mobile,Harvard University,I don't use Tinder,440,0.502393071029378,True,16/10/21
what movies made in 2004 were pg,University,Indiana University,Yes,116,0.746798065706242,True,11/05/21
find movies with robert diniero in it,Mobile,Indiana University,No,497,0.128377151959388,True,06/12/21
have pg 13 movies for the kidz,Mobile,Indiana University,I don't use Tinder,191,0.334576410925021,False,30/08/21
list the science fiction movies directed by shawn levy,Mobile,Johns Hopkins University,Yes,25,0.770586488207449,False,02/11/21
what was the last film elizabeth montgomery starred in,Mobile,Johns Hopkins University,No,33,0.801974325929661,True,11/09/21
did george clooney direct any comedy films,Mobile,Johns Hopkins University,I don't use Tinder,323,0.458444509348609,True,27/12/21
what is brad pitts first movie,Mobile,Northwestern University,Yes,385,0.073275442736484,True,15/04/21
find me the movie that has a aerosmith song,University,Northwestern University,No,279,0.690198148293467,False,24/11/21
are there any drama movies with seth green,University,Northwestern University,I don't use Tinder,451,0.598791322251542,True,04/01/22
what is the movie with an aerosmith song,Mobile,Ohio State University,Yes,134,0.19378046061727,True,28/06/21
what is the highest rated kids new release,Mobile,Ohio State University,No,129,0.298094417043094,False,24/06/21
worst review for 2011 movies,University,Ohio State University,I don't use Tinder,491,0.809404458125238,False,20/11/21
show me the milos forman movies from the 1980s,Mobile,Princeton University,Yes,498,0.368696957262165,False,12/12/21
lets find an independent film company,Mobile,Princeton University,No,286,0.984574488502146,False,05/04/21
which movies were based off of video games besides resident evil,Web,Princeton University,I don't use Tinder,165,0.918449317882038,True,14/05/21
did dame judy dench star in a british film about queen elizabeth,Web,San Diego State University,Yes,336,0.661003674545908,False,27/04/21
present list of family movies that chris columbus directed,Mobile,San Diego State University,No,496,0.439251694822746,False,30/10/21
find a movie with dogs as the main character,Mobile,San Diego State University,I don't use Tinder,38,0.340651956028663,True,24/12/21
show me movies about horse racing,Mobile,Santa Clara University,Yes,12,0.2849153763712,False,07/12/21
show me morgan freeman movies from the 90s,University,Santa Clara University,No,219,0.535104273253071,True,16/03/21
find me the movies that starred anne hathaway and julie andrews,Web,Santa Clara University,I don't use Tinder,115,0.229603371230924,False,18/03/21
has sandra bullock made any g rated movies,Mobile,Southern Methodist University,Yes,406,0.403776135683167,True,07/12/21
list the dirty harry films from the 1980s,University,Southern Methodist University,No,147,0.597275618239679,False,05/07/21
show me movies about strippers,University,Southern Methodist University,I don't use Tinder,160,0.087563435241094,True,02/09/21
are there any meg ryan romantic comedy movies that are considered must see,Mobile,Stanford University,Yes,132,0.914107488691551,False,22/04/21
what was james camerons directorial debut,Web,Stanford University,No,295,0.862282011481372,True,25/12/21
what are top 50 movies of all time,Mobile,Stanford University,I don't use Tinder,1,0.82166092128377,True,01/01/22
find me comedy movies with liam hemsworth,University,Tulane University,Yes,396,0.974231983176712,False,20/12/21
i want to see cradle 2 the grave,University,Tulane University,No,253,0.449570970685449,False,18/05/21
what was the most popular movie from 2004,Mobile,Tulane University,I don't use Tinder,329,0.12436187234673,False,07/09/21
what is the g rated movie about rabbits looking for a new home,Mobile,University of Pennsylvania,Yes,276,0.050993457463642,False,02/06/21
what latest 3d movie of any genre is reccommend,Mobile,University of Pennsylvania,No,474,0.151621660940284,True,12/06/21
how many movies have tim burton and johnny depp done together,Web,University of Pennsylvania,I don't use Tinder,91,0.631058953054285,False,12/05/21
how many times has matt damon been jason bourne,Mobile,University of Wisconsin-Madison,Yes,194,0.762855034164686,False,25/01/21
whats the latetest foreign romantic movie with lots of sex and sadness,Mobile,University of Wisconsin-Madison,No,17,0.087270891716916,True,20/03/21
list movies with jeremy piven released in the 1990s,Mobile,University of Wisconsin-Madison,I don't use Tinder,263,0.230632294025529,False,08/10/21
show me the collection of action movies of arnold,University,University of Alabama,Yes,316,0.855203638024978,False,17/01/21
are there comic book movies that are over pg 13,University,University of Alabama,No,18,0.661854081928288,False,26/10/21
the new batman movie looks epic,Web,University of Alabama,I don't use Tinder,337,0.323623127183617,False,21/12/21
show me movies who won awards,Mobile,"University of California, Berkeley",Yes,315,0.798789869142873,True,27/12/21
what is the year that dirty dancing was released,Mobile,"University of California, Berkeley",No,268,0.933833455819967,True,16/12/21
favorite quote from action movies,Web,"University of California, Berkeley",I don't use Tinder,297,0.839736712370216,True,07/02/21
find me the g rated movies with dogs that were released in the 2000s,University,"University of California, Davis",Yes,212,0.679352776856077,True,07/12/21
are there any silent movies made after 1930,Mobile,"University of California, Davis",No,168,0.503809927259198,False,23/12/21
who was the actress in the goodbye girl with richard dreyfuss,Mobile,"University of California, Davis",I don't use Tinder,238,0.147992425732528,True,09/03/21
which movies are made with video game plots,University,"University of California, Los Angeles",Yes,287,0.556021794282196,False,20/11/21
what video game movies are due to release in 2013,Mobile,"University of California, Los Angeles",No,484,0.206716254823571,False,21/12/21
id like the not to be missed nicole kidman musical,Mobile,"University of California, Los Angeles",I don't use Tinder,496,0.812132053895155,True,08/09/21
what movie has the most remakes,University,"University of California, Santa Barbara",Yes,328,0.994819820686838,False,24/12/21
what shakespeare films take place in italy,Mobile,"University of California, Santa Barbara",No,209,0.479213351905015,True,06/11/21
what was channing tatums first movie,Mobile,"University of California, Santa Barbara",I don't use Tinder,288,0.085835397179171,True,07/08/21
i would like a list of movies about dancing from the past 10 years,University,University of Colorado Boulder,Yes,168,0.359714779016382,False,29/01/21
who stars in project x,Mobile,University of Colorado Boulder,No,167,0.208538285763262,False,05/01/22
find action movies featuring comic book characters,Mobile,University of Colorado Boulder,I don't use Tinder,265,0.761977670628164,True,31/03/21
what are some g rated movies with fairies,Web,University of Miami,Yes,228,0.142160675209011,True,19/10/21
name a movie starring britney spears,University,University of Miami,No,30,0.427884386132541,True,27/11/21
what movie did rod serling write,Mobile,University of Miami,I don't use Tinder,149,0.757908291513765,False,30/04/21
is there an animated adult fantasy movie,Mobile,University of Michigan,Yes,479,0.677935498275761,False,17/03/21
the song sunshine on my shoulders was the soundtrack for what movie,Mobile,University of Michigan,No,182,0.487759751052418,True,10/12/21
are there any movies about popular game shows,Web,University of Michigan,I don't use Tinder,32,0.953316240857137,True,02/11/21
find me the name of the actor that played v in v for vendetta,Mobile,University of Oregon,Yes,382,0.766184511626604,True,30/12/21
what was the last terminator sequel,Mobile,University of Oregon,No,95,0.562995943732033,False,07/07/21
what science fiction movies were directed by george lucas,Mobile,University of Oregon,I don't use Tinder,461,0.362200999347213,False,29/04/21
who directed princess bride,Web,University of Southern California,Yes,14,0.543351510304656,True,29/12/21
who directed james and the giant peach,Mobile,University of Southern California,No,420,0.890039824963378,False,22/08/21
name a western comedy,Mobile,University of Southern California,I don't use Tinder,104,0.780710644529739,False,31/12/21
what type of movie is nine,Mobile,University of Virginia,Yes,253,0.426377395361806,True,28/04/21
how many movies have starred brad pitt,University,University of Virginia,No,243,0.825858336407901,True,09/06/21
i am looking for a movie about talking animals,Mobile,University of Virginia,I don't use Tinder,250,0.805053767499505,True,02/12/21
find a john malcovich thriller,University,Vanderbilt University,Yes,419,0.505878400519808,True,20/02/21
channing tatum has played what starring roles,University,Vanderbilt University,No,358,0.526232520389434,True,11/09/21
list of actors a beautiful mind,Mobile,Vanderbilt University,I don't use Tinder,215,0.422390544707786,False,08/06/21
avatar came out when and what did it gross,Web,Wesleyan University,Yes,22,0.078417818187022,True,03/01/22
did angelina jolie play a russian in salt,Mobile,Wesleyan University,No,139,0.495167992612439,False,28/06/21
did they make a movie version of absolutely fabulous,Web,Wesleyan University,I don't use Tinder,118,0.133782711080099,True,11/11/21
show me a comedy movie with eddie murphy,Mobile,University of Texas,Yes,284,0.671064735232619,True,08/09/21
what is brave about,Mobile,University of Texas,No,139,0.096657609890754,False,27/08/21
has ashton kutcher made any movies with zombies,Mobile,University of Texas,I don't use Tinder,19,0.574911879055109,False,25/02/21
what movie stars christopher walken an sean penn,University,"University of California, San Diego",Yes,129,0.117208620869798,True,27/06/21
show me movies starring michael j fox from 1993,University,"University of California, San Diego",No,202,0.892243530042936,True,05/04/21
who starred in marley and me,Mobile,"University of California, San Diego",I don't use Tinder,121,0.313187699812203,True,04/04/21
what movie has the song down with the sickness,Mobile,Miami University (Ohio),Yes,166,0.323840459831569,False,24/07/21
did simon pegg write any movies,Web,Miami University (Ohio),No,225,0.338949847646836,False,20/08/21
are there any pg movies with car chases,University,Miami University (Ohio),I don't use Tinder,110,0.627540726724291,True,15/01/21
what movie won the most awards in 2005,Mobile,University of Maine,Yes,375,0.41333885299334,True,23/04/21
what is puss in boots about,Mobile,University of Maine,No,27,0.206849877003584,True,19/11/21
how many movies have been released in the last ten years that involved terrorism,Mobile,University of Maine,I don't use Tinder,480,0.037057828502851,True,17/02/21
who directed runaway jury,Web,Texas Tech University,Yes,330,0.275274332558487,False,30/08/21
show me a good spy movie based in england,Mobile,Texas Tech University,No,104,0.803605745654058,True,15/12/21
what popular films released last month,Web,Texas Tech University,I don't use Tinder,206,0.593354825662715,False,28/06/21
did dean parisot direct sigourney weaver and tim allen in a comedy,University,University of North Carolina,Yes,204,0.404024612774191,True,14/11/21
who directed the help,Mobile,University of North Carolina,No,376,0.30405595210182,True,08/06/21
what is the title of woody allens first movie,University,University of North Carolina,I don't use Tinder,85,0.800619414566336,True,11/09/21
what are some police dramas from the 90s,Mobile,University of Arkansas,Yes,405,0.066611435626225,True,09/11/21
how many films did clive owen play in,University,University of Arkansas,No,253,0.974524749768083,False,26/08/21
are there any films that harmony korine regrets directing andor releasing to the public,Mobile,University of Arkansas,I don't use Tinder,316,0.667947168810827,True,23/02/21
show me an alfred hitchcock movie about trains,University,University of Mississippi,Yes,21,0.688984244439141,False,12/02/21
who stars in rumble in the bronx,University,University of Mississippi,No,420,0.503567133022722,False,23/09/21
what was the first movie patrick stewart played in,Mobile,University of Mississippi,I don't use Tinder,474,0.435279590293507,False,17/02/21
what is the film john carter about,Mobile,Baylor University,Yes,299,0.117766635110212,True,22/11/21
what is the longest running time for a movie in film history,Mobile,Baylor University,No,341,0.441439363668793,False,07/04/21
what was the release year for notes on a scandal,Mobile,Baylor University,I don't use Tinder,217,0.79714294147999,True,23/06/21
did milos forman direct a film with edward norton,Mobile,Texas A&M University,Yes,341,0.131743186175304,False,04/11/21
how many movies did christopher walkin star in,Mobile,Texas A&M University,No,379,0.854142335848094,False,18/11/21
i want to find a list of pg rated comedies of this year,University,Texas A&M University,I don't use Tinder,458,0.63132939209128,False,03/01/21
what are some movies from the 80s starring bruce willis,University,University of Oklahoma,Yes,349,0.962977178496318,False,19/06/21
waht was the plot of the deep blue sea,Mobile,University of Oklahoma,No,439,0.324498320288583,True,29/11/21
did guillermo del toro direct any moves rated pg,University,University of Oklahoma,I don't use Tinder,199,0.110354891322915,False,10/04/21
who played james in james and the giant peach,Mobile,Yale University,Yes,266,0.262333135064884,False,05/08/21
what movies from 2006 star val kilmer,Mobile,Yale University,No,30,0.866982325474209,True,18/04/21
what kind of movie is wanderlust,University,Yale University,I don't use Tinder,101,0.023370371467945,True,29/08/21
did whitney houston sing in the preachers wife,University,Cal Poly San Luis Obispo,Yes,285,0.152817263992402,False,23/11/21
what techno thriller gets a low rating,University,Cal Poly San Luis Obispo,No,263,0.442300873374064,True,08/06/21
any good horror films that came out in 2008,Mobile,Cal Poly San Luis Obispo,I don't use Tinder,441,0.559420293561596,False,12/12/21
where can i watch a preview of moneyball,Mobile,Carnegie Mellon University,Yes,230,0.629192815746649,True,22/10/21
what is the most recent sean connery film,Mobile,Carnegie Mellon University,No,390,0.93714167921655,False,09/09/21
are there any scary pg rated movies,Mobile,Carnegie Mellon University,I don't use Tinder,101,0.111137616041682,False,08/11/21
what is a recent george clooney movie with high viewers rating,University,Clemson University,Yes,356,0.271105576529932,True,17/12/21
which animated childrens movies are considered timeless,Web,Clemson University,No,254,0.449536356107368,True,21/11/21
find me the movie with the song my heart will go on,Mobile,Clemson University,I don't use Tinder,110,0.300403894499097,False,06/06/21
what are some batman movies from the 1990s,Mobile,University of Denver,Yes,461,0.676117818824436,True,28/05/21
what horror movies have marilyn manson on the soundtrack,University,University of Denver,No,219,0.207315250282247,True,08/01/22
show me terry gilliam movies starring jeff bridges,University,University of Denver,I don't use Tinder,458,0.091564820311493,True,07/07/21
was there a trailer for bowling for columbine,Web,University of Washington,Yes,119,0.247205874575372,True,11/04/21
when did interview with a vampire come out,University,University of Washington,No,171,0.411470449153394,False,20/11/21
who starred in who framed roger rabbit,University,University of Washington,I don't use Tinder,189,0.264231075227473,False,30/03/21
who directed 310 to yuma,University,University of Illinois,Yes,102,0.713193002567319,True,01/01/21
what movies have batman and robin,University,University of Illinois,No,145,0.777553411791293,False,06/01/22
is there a horror movie starring jennifer lopez,University,University of Illinois,I don't use Tinder,375,0.121949254039876,True,05/08/21
did the mpaa give doubt a pg 13 rating,Mobile,New York University,Yes,35,0.304070616378725,True,11/09/21
did vin diesel star in any comdedies,Mobile,New York University,No,478,0.185843905208749,False,13/01/21
did ray liota direct any films,Mobile,New York University,I don't use Tinder,433,0.077619208445407,True,10/03/21
did gwyneth paltrow play a mathematician in a movie with anthony hopkins,University,Butler University,Yes,255,0.354705035517289,False,28/11/21
is there a movie based on a shakespeare play,Mobile,Butler University,No,134,0.929840397493506,True,22/11/21
find me a movie with the song lets hear it for the boys,Mobile,Butler University,I don't use Tinder,79,0.230384064252593,True,05/04/21
what was the fog rated,Mobile,Washington University in St. Louis,Yes,495,0.486620181284302,False,02/01/21
what was johnny depps first movie,Mobile,Washington University in St. Louis,No,14,0.523618460369209,False,02/07/21
what was goodfellas rated,Mobile,Washington University in St. Louis,I don't use Tinder,357,0.667630596253243,False,15/10/21
what was the name of the donkey in shrek,University,Northern Illinois University,Yes,444,0.331560203897348,False,27/11/21
did joe pesci direct any films,Mobile,Northern Illinois University,No,71,0.614439618550341,False,26/12/21
what are some horror movies from the 1970s,University,Northern Illinois University,I don't use Tinder,53,0.107506472543868,True,21/07/21
show me a deborah harry movie,Mobile,University of Iowa,Yes,231,0.172360872664425,True,06/03/21
kung fu panda 2,Web,University of Iowa,No,436,0.443484636437872,False,25/05/21
what year was the movie the seven year itch made,University,University of Iowa,I don't use Tinder,419,0.305337807819801,True,03/07/21
is there a comedy crime drama,University,Dartmouth College,Yes,388,0.894167650708312,False,22/12/21
what movie stared john travolta and debra winger,University,Dartmouth College,No,196,0.973663446777395,True,14/12/21
directors of all the batman movies,University,Dartmouth College,I don't use Tinder,450,0.868019198053699,True,10/01/21
what are the best werewolf movies,Mobile,Loyola Marymount University,Yes,150,0.639947113494527,False,22/01/21
who voices shrek in shrek,Mobile,Loyola Marymount University,No,392,0.601766181468592,False,01/05/21
was ray liota in any comedies,Mobile,Loyola Marymount University,I don't use Tinder,446,0.07035490197882,False,16/10/21
what movie stars reese witherspoon in 2004,Mobile,Williams College,Yes,365,0.355319490729015,True,27/12/21
what movie did ursula andress first appear in,University,Williams College,No,349,0.845023579083327,False,15/08/21
are there any movies set in the middle east starring george clooney,Mobile,Williams College,I don't use Tinder,60,0.67696964471045,True,26/09/21
what was a love story about a woman who had alzheimers,Mobile,University of Maryland,Yes,126,0.827777016987455,True,16/01/21
whats a john huston flick from the 1970s,University,University of Maryland,No,250,0.674651643554846,True,24/03/21
who played as princess fiona in shrek,Mobile,University of Maryland,I don't use Tinder,223,0.942232756159649,False,23/12/21
is the last airbender rated g,Web,UMass Amherst,Yes,59,0.375567946440623,False,03/01/22
show me some grat action movies from the 90s,Mobile,UMass Amherst,No,2,0.09663877182702,True,10/02/21
show me dramas about the british royal family,Web,UMass Amherst,I don't use Tinder,180,0.188546359792141,True,30/07/21
what was the first movie ever released,University,University of Arizona,Yes,122,0.829005678860803,True,18/01/21
are there any movies with catherine ohara that were set during christmas time,Web,University of Arizona,No,259,0.295704954457771,False,24/03/21
show me a james bond movie starring sean connery,Mobile,University of Arizona,I don't use Tinder,11,0.887013468084964,False,03/12/21
what was the title of the bio pic about robert e howard,University,Texas Christian University,Yes,99,0.219397713844132,True,04/09/21
what is the theme song to stand by me,University,Texas Christian University,No,297,0.525853876056183,False,09/01/21
when did runaway jury come out,University,Texas Christian University,I don't use Tinder,189,0.086618290795268,True,22/05/21
who directed the japanese film versus,University,Emory University,Yes,376,0.433284426937856,True,23/04/21
show me a film that ben stiller directed,Mobile,Emory University,No,343,0.915244335567357,False,25/10/21
name a kirk douglas science fiction film,University,Emory University,I don't use Tinder,113,0.307016452483256,False,09/11/21
are there any five star kevin bacon movies,Mobile,Columbia University,Yes,134,0.850427851295101,True,06/05/21
who stars in the girl with the dragon tattoo,University,Columbia University,No,448,0.858702890159702,False,21/11/21
who was the male lead in gone with the wind,University,Columbia University,I don't use Tinder,20,0.990502084722652,True,29/11/21
who played jake sully in avatar,Web,Purdue University,Yes,311,0.138906881568135,False,17/08/21
who directed pirates of the caribbean,Mobile,Purdue University,No,269,0.787064795399654,False,12/11/21
what are some fun highly rated action movieds,University,Purdue University,I don't use Tinder,272,0.263131134344082,False,18/11/21
did people like or hate the last twilight movie,University,Tufts University,Yes,472,0.322140270236576,True,22/12/21
what are the best johnny depp movies,Mobile,Tufts University,No,128,0.36743998407414,False,15/12/21
show me movies directed by alexander payne from the 2000s,Web,Tufts University,I don't use Tinder,279,0.565794600095552,False,27/05/21
what are some good horror movies from 1974,Web,University of Richmond,Yes,251,0.319182685426381,False,13/09/21
find me a movie with the song over the rainbow in it,Mobile,University of Richmond,No,403,0.558691429321289,True,07/01/22
i want a 1960s zombie flick,Mobile,University of Richmond,I don't use Tinder,385,0.957239250818311,True,17/11/21
how many lord of the rings films are there,Mobile,Quinnipiac University,Yes,407,0.41455000341184,True,19/02/21
show me the latest trailer for the avengers,Mobile,Quinnipiac University,No,280,0.385224676896483,True,08/03/21
who directed beaty and the beast,Mobile,Quinnipiac University,I don't use Tinder,250,0.580185097333433,False,13/02/21
show me a comedy with nick swardson,Mobile,United States Naval Academy,Yes,180,0.746141275326538,True,05/02/21
