Question,Segment Type,Segment Description,Answer,Count,Percentage,Single,timestamp
show me a list of family movies with holiday themes,University,Old Dominion University,I don't use Tinder,27,0.021103666172545,True,22/02/21
true stories about hispanic musicians,University,University of Tampa,Yes,218,0.766304733780881,False,12/06/21
list all movies staring brad pitt,University,University of Tampa,No,476,0.997753562871356,True,20/01/21
what movies has ellen page been in,Mobile,University of Tampa,I don't use Tinder,255,0.407973648076724,True,04/01/22
show me action movies with vin diesel,Mobile,Roger Williams University,Yes,52,0.301707784017826,False,13/10/21
run repo man,University,Roger Williams University,No,161,0.34983311909728,True,23/12/21
can you show me the movies cher was in,Mobile,Roger Williams University,I don't use Tinder,275,0.934164373127697,True,01/05/21
what was the name of harrison fords character in star wars,Mobile,Penn State University,Yes,195,0.916405852007799,True,22/08/21
i want a r rated film that was later changed to pg,Mobile,Penn State University,No,408,0.172717350938749,True,13/06/21
who played andy duphrane in shawshank redemption,Mobile,Penn State University,I don't use Tinder,329,0.782321487742692,True,23/02/21
what was james deans last film,Mobile,Minnesota State University Mankato,Yes,143,0.098518003923915,True,27/03/21
find an action flick with martin lawrence,University,Minnesota State University Mankato,No,151,0.494907803667235,True,07/01/22
were any movies adapted from stage in the 2000s,Web,Minnesota State University Mankato,I don't use Tinder,244,0.412938882536763,False,27/11/21
who directed drive,Web,University of Florida,Yes,201,0.222232967182739,True,17/02/21
show movies from the 1960s directed by stanley kubrick,Mobile,University of Florida,No,201,0.406400461007249,True,23/11/21
who directed blow,Mobile,University of Florida,I don't use Tinder,371,0.799634539964772,True,26/01/21
show me action movies starring sylvester stallone,University,Boston College,Yes,329,0.699904050922034,False,11/03/21
what movies has mariah carey been in,University,Boston College,No,84,0.140061470998158,False,03/12/21
what horror movies came out in the 80s,Mobile,Boston College,I don't use Tinder,75,0.426620365337437,True,30/07/21
i want to see a action comedy,University,Boston University,Yes,178,0.355643567915004,False,07/06/21
disney cartoon with classical music and animals,Mobile,Boston University,No,110,0.136846401922578,False,22/12/21
are there any horror movies with a g rating,Mobile,Boston University,I don't use Tinder,206,0.352159345103286,False,01/10/21
